{
  "aggregation": {
    "global_weighting": "map_weighted",
    "semantic_weighting": "map_weighted_within_category",
    "unit": "individual RGB map, then mean over all maps and seeds"
  },
  "artifact": "texture-table2",
  "complete": true,
  "dataset": {
    "manifest_sha256": "63e6597b835b6b3f25dca64ea1f0832e42ae49869010795ef8e02117d56070e1",
    "map_count": 78,
    "semantics": [
      "AO",
      "ARM",
      "DIFF",
      "Displacement",
      "metal",
      "normal",
      "rough",
      "specular"
    ],
    "set_count": 18
  },
  "generated_at_utc": "2026-08-05T00:46:34.615516+00:00",
  "limitations": [
    {
      "code": "texture_file_selection_not_published",
      "detail": "The paper names 18 sets and eight map categories but not exact source files. data/manifests/textures.json freezes a non-duplicating 78-map selection."
    },
    {
      "code": "optimizer_and_seed_not_published",
      "detail": "Adam and seeds 0/1/2 are explicit reproduction choices. The paper publishes the dual learning rates, cosine schedule, batch size, epochs, and batches per epoch, but not optimizer or seeds."
    },
    {
      "code": "sampling_text_is_ambiguous",
      "detail": "The main text says bilinear-filtered targets while the appendix says random pixel locations. The runner samples random native pixel locations; at those locations the bilinear target is exactly the stored texel."
    },
    {
      "code": "pytorch_latency_not_fused_paper_latency",
      "detail": "The 3F/4F sweep has not been run, so no latency is recorded anywhere in this artifact; the empty latency columns are absent measurements, not fast ones. If run, it would time checkpoint inference in PyTorch, which is not the paper's fused HIP/WMMA three-channel decoder. results/hip_texture_geometry.json measures the repository's own fused kernel at the Grid family's decoder geometry (input widths 119, 153, 45 and 47, matching this receipt) but with random weights, so it gives cost without quality. That kernel cannot express the NTC family at all: its 68-channel aggregate exceeds the kernel's 32-channel limit, and its 12-dimension tiled encoding has no counterpart in the kernel's aggregation."
    },
    {
      "code": "figure8_crop_not_published",
      "detail": "The paper states a 100-pixel Paving Stones sample but does not publish crop coordinates. The generator defaults to a centered 100x100 crop and records the exact rectangle."
    }
  ],
  "paper": "PEPS Extended arXiv:2604.24167v1",
  "profile": "full",
  "progress": {
    "accounted_optimizer_steps": 71280000,
    "active_workers": 0,
    "artifact": "table2",
    "canonical": true,
    "checkpoint_errors": [],
    "checkpointed_incomplete_jobs": 0,
    "complete": true,
    "completed_jobs": 594,
    "config": "configs/paper/texture_full.toml",
    "config_sha256": "24a5936cf3788f83e495a343d59148dcf00de9bfa7608592eee2eb764c480478",
    "expected_jobs": 594,
    "expected_optimizer_steps": 71280000,
    "job_completion_fraction": 1.0,
    "optimizer_step_completion_fraction": 1.0,
    "output_dir": "/home/aup/yy/workspace/peps/results/work/texture-repro/table2/24a5936cf378-63e6597b835b-ca6664fc7b36",
    "per_rank": {
      "0": {
        "completed_jobs": 297,
        "expected_jobs": 297,
        "optimizer_steps": 35640000
      },
      "1": {
        "completed_jobs": 297,
        "expected_jobs": 297,
        "optimizer_steps": 35640000
      }
    },
    "profile": "full",
    "result_errors": [],
    "throughput_observation": {
      "aggregate_checkpointed_steps_per_second": 91.5439739158169,
      "naive_remaining_seconds_at_current_job_mix": 0.0,
      "warning": "Not a guaranteed ETA: method/output widths differ and progress appears only at checkpoint boundaries."
    },
    "workers": [
      {
        "artifact": "table2",
        "completed_records": 297,
        "device": "cuda:0",
        "effective_state": "complete",
        "finished_at_utc": "2026-08-04T18:56:54.155908+00:00",
        "liveness_evidence": {
          "reason": "pid_not_present_or_unreadable",
          "status": "not_alive"
        },
        "output_dir": "/home/aup/yy/workspace/peps/results/work/texture-repro/table2/24a5936cf378-63e6597b835b-ca6664fc7b36",
        "pid": 3383038,
        "process_alive": false,
        "process_identity": {
          "boot_id": "0ca11c34-38ca-4d2c-aa05-091065da66c3",
          "command_sha256": "24b0b7e2e0abb880ecc7bd0a9ba20389ce24c98aa3f680a57ea5baeec8164c87",
          "start_time_ticks": 43063049
        },
        "rank": 0,
        "schema": "peps.texture_worker_status",
        "schema_version": 1,
        "selected_instances": [
          "aerial-rocks-02",
          "bench-vice-01",
          "bricks-090",
          "cannon-01",
          "cardboard-box-01",
          "clay-roof-tiles-02",
          "fabric-pattern-07",
          "forest-sand-01",
          "garden-gnome",
          "garden-sprinkler-01",
          "metal-plates-013",
          "paving-stones-070",
          "rails-001",
          "red-dirt-mud-01",
          "roof-09",
          "treasure-chest",
          "wood-063",
          "wood-planks"
        ],
        "selected_jobs": 297,
        "selected_methods": [
          "BI-Grid",
          "Grid-PEPS4F",
          "Grid-PEPS4F-25",
          "Grid-PinkPEPS4F",
          "Grid-PinkPEPS4F-25",
          "LPE",
          "NTC_N",
          "NTC_PEPS",
          "NTC_PEPS-25",
          "NTC_PinkPEPS",
          "NTC_PinkPEPS-25"
        ],
        "started_at_utc": "2026-07-27T00:29:12.439432+00:00",
        "state": "complete",
        "verification_receipt": "/home/aup/yy/workspace/peps/results/texture_repro/dataset_verification.json",
        "verification_receipt_current": true,
        "world_size": 2
      },
      {
        "artifact": "table2",
        "completed_records": 297,
        "device": "cuda:0",
        "effective_state": "complete",
        "finished_at_utc": "2026-08-04T19:37:22.102280+00:00",
        "liveness_evidence": {
          "reason": "pid_not_present_or_unreadable",
          "status": "not_alive"
        },
        "output_dir": "/home/aup/yy/workspace/peps/results/work/texture-repro/table2/24a5936cf378-63e6597b835b-ca6664fc7b36",
        "pid": 3383039,
        "process_alive": false,
        "process_identity": {
          "boot_id": "0ca11c34-38ca-4d2c-aa05-091065da66c3",
          "command_sha256": "0866ea4f5e612b32622745647babc7cae2e6b91b675eac373514f2ec9753ceda",
          "start_time_ticks": 43063049
        },
        "rank": 1,
        "schema": "peps.texture_worker_status",
        "schema_version": 1,
        "selected_instances": [
          "aerial-rocks-02",
          "bench-vice-01",
          "bricks-090",
          "cannon-01",
          "cardboard-box-01",
          "clay-roof-tiles-02",
          "fabric-pattern-07",
          "forest-sand-01",
          "garden-gnome",
          "garden-sprinkler-01",
          "metal-plates-013",
          "paving-stones-070",
          "rails-001",
          "red-dirt-mud-01",
          "roof-09",
          "treasure-chest",
          "wood-063",
          "wood-planks"
        ],
        "selected_jobs": 297,
        "selected_methods": [
          "BI-Grid",
          "Grid-PEPS4F",
          "Grid-PEPS4F-25",
          "Grid-PinkPEPS4F",
          "Grid-PinkPEPS4F-25",
          "LPE",
          "NTC_N",
          "NTC_PEPS",
          "NTC_PEPS-25",
          "NTC_PinkPEPS",
          "NTC_PinkPEPS-25"
        ],
        "started_at_utc": "2026-07-27T00:29:12.429028+00:00",
        "state": "complete",
        "verification_receipt": "/home/aup/yy/workspace/peps/results/texture_repro/dataset_verification.json",
        "verification_receipt_current": true,
        "world_size": 2
      }
    ],
    "world_size": 2
  },
  "rows": [
    {
      "AO": 40.46342964502216,
      "ARM": 37.36533506084111,
      "DIFF": 36.770420758742716,
      "Displacement": 51.15380347952548,
      "complete": true,
      "compression_factor_mean": 12.992025384318925,
      "decoder_params_max": 10578,
      "decoder_params_min": 9993,
      "delta_psnr": -1.3522211746835637,
      "delta_ssim": -0.01066989669433005,
      "encoder_params": 16777216,
      "expected_job_count": 54,
      "expected_map_observation_count": 234,
      "job_count": 54,
      "map_observation_count": 234,
      "metal": 47.0734038246698,
      "method": "LPE",
      "normal": 32.558259744524875,
      "paper_psnr": 40.21,
      "paper_ssim": 0.95,
      "profile": "full",
      "psnr": 38.85777882531644,
      "rough": 37.38858720247576,
      "specular": 42.149256122103644,
      "ssim": 0.9393301033056699,
      "total_params_max": 16787794,
      "total_params_min": 16787209,
      "verification_status": "complete_protocol_assumption"
    },
    {
      "AO": 40.86915664562374,
      "ARM": 38.24932453077468,
      "DIFF": 37.05483774660544,
      "Displacement": 51.18832001901922,
      "complete": true,
      "compression_factor_mean": 12.225422314792414,
      "decoder_params_max": 14674,
      "decoder_params_min": 14089,
      "delta_psnr": -0.964606721365314,
      "delta_ssim": -0.008096336248593405,
      "encoder_params": 17825792,
      "expected_job_count": 54,
      "expected_map_observation_count": 234,
      "job_count": 54,
      "map_observation_count": 234,
      "metal": 48.61703819926456,
      "method": "NTC_N",
      "normal": 32.471353877226356,
      "paper_psnr": 40.2,
      "paper_ssim": 0.95,
      "profile": "full",
      "psnr": 39.23539327863469,
      "rough": 38.31185048275221,
      "specular": 43.379793280870736,
      "ssim": 0.9419036637514066,
      "total_params_max": 17840466,
      "total_params_min": 17839881,
      "verification_status": "complete_protocol_assumption"
    },
    {
      "AO": 42.09941043146448,
      "ARM": 39.720231755863786,
      "DIFF": 38.23389634899346,
      "Displacement": 53.19665206629081,
      "complete": true,